number,value,datetime_start,datetime_complete,duration,params_bagging_temperature,params_bootstrap_type,params_depth,params_iterations,params_l2_leaf_reg,params_learning_rate,params_od_type,params_od_wait,params_random_strength,state
99,0.860785498489426,2025-08-01 09:15:20.444936,2025-08-01 09:15:24.341502,0 days 00:00:03.896566,0.17016882887768991,Bayesian,8,709,0.01666916392971425,0.005554533186276907,Iter,26,2.48730747193654e-05,COMPLETE
